{
  "schemaVersion": 1,
  "kind": "batch",
  "concurrency": 3,
  "results": [
    {
      "file": "sample.wav",
      "state": "completed",
      "analysis": {
        "schemaVersion": 1,
        "kind": "analysis",
        "input": {
          "schemaVersion": 1,
          "kind": "inspection",
          "file": {
            "name": "sample.wav",
            "sizeBytes": 384044,
            "container": "wav"
          },
          "streams": [
            {
              "index": 0,
              "codec": "pcm_f32le",
              "sampleRate": 48000,
              "channels": 1,
              "channelLayout": null,
              "declaredDurationSeconds": 2,
              "language": null
            }
          ],
          "selectedStream": {
            "index": 0,
            "codec": "pcm_f32le",
            "sampleRate": 48000,
            "channels": 1,
            "channelLayout": null,
            "declaredDurationSeconds": 2,
            "language": null
          },
          "declaredDurationSeconds": 2
        },
        "durationSeconds": 2,
        "frames": 96000,
        "decodedPcmSha256": "973ee2b80aba795831a6cf71772bfe381cd34514ec3e5e92ba94ce242874c850",
        "state": "measured",
        "integratedLufs": -23,
        "truePeakDbtp": -20,
        "loudnessRangeLu": null,
        "samplePeakDbfs": -19.99999987057016,
        "rmsDbfs": -23.010299939329553,
        "channels": [
          {
            "samplePeakDbfs": -19.99999987057016,
            "rmsDbfs": -23.010299939329553,
            "crestFactorDb": 3.010300068759392,
            "dcOffset": -3.9320398788807625e-19,
            "nearFullScaleSamples": 0,
            "longestNearFullScaleRun": 0
          }
        ],
        "stereoCorrelation": null,
        "channelImbalanceDb": null,
        "silence": {
          "thresholdDbfs": -60,
          "minSeconds": 0.2,
          "totalSeconds": 0,
          "leadingSeconds": 0,
          "trailingSeconds": 0,
          "intervals": [],
          "totalIntervals": 0
        },
        "discontinuities": {
          "threshold": 0.8,
          "totalCandidates": 0,
          "candidates": []
        },
        "bandEnergy": {
          "method": "one-pole-crossover",
          "lowDbfs": -37.152177645090624,
          "midDbfs": -25.063823570022507,
          "highDbfs": -31.162242052076063
        },
        "waveform": [
          {
            "startSeconds": 0,
            "endSeconds": 0.1,
            "min": -0.10000000149011612,
            "max": 0.10000000149011612,
            "rms": 0.07071067825957048
          },
          {
            "startSeconds": 0.1,
            "endSeconds": 0.2,
            "min": -0.10000000149011612,
            "max": 0.10000000149011612,
            "rms": 0.07071067825957048
          },
          {
            "startSeconds": 0.2,
            "endSeconds": 0.3,
            "min": -0.10000000149011612,
            "max": 0.10000000149011612,
            "rms": 0.07071067825957048
          },
          {
            "startSeconds": 0.3,
            "endSeconds": 0.4,
            "min": -0.10000000149011612,
            "max": 0.10000000149011612,
            "rms": 0.07071067825957048
          },
          {
            "startSeconds": 0.4,
            "endSeconds": 0.5,
            "min": -0.10000000149011612,
            "max": 0.10000000149011612,
            "rms": 0.07071067825957048
          },
          {
            "startSeconds": 0.5,
            "endSeconds": 0.6,
            "min": -0.10000000149011612,
            "max": 0.10000000149011612,
            "rms": 0.07071067825957048
          },
          {
            "startSeconds": 0.6,
            "endSeconds": 0.7,
            "min": -0.10000000149011612,
            "max": 0.10000000149011612,
            "rms": 0.07071067825957048
          },
          {
            "startSeconds": 0.7,
            "endSeconds": 0.8,
            "min": -0.10000000149011612,
            "max": 0.10000000149011612,
            "rms": 0.07071067825957048
          },
          {
            "startSeconds": 0.8,
            "endSeconds": 0.9,
            "min": -0.10000000149011612,
            "max": 0.10000000149011612,
            "rms": 0.07071067825957048
          },
          {
            "startSeconds": 0.9,
            "endSeconds": 1,
            "min": -0.10000000149011612,
            "max": 0.10000000149011612,
            "rms": 0.07071067825957048
          },
          {
            "startSeconds": 1,
            "endSeconds": 1.1,
            "min": -0.10000000149011612,
            "max": 0.10000000149011612,
            "rms": 0.07071067825957048
          },
          {
            "startSeconds": 1.1,
            "endSeconds": 1.2,
            "min": -0.10000000149011612,
            "max": 0.10000000149011612,
            "rms": 0.07071067825957048
          },
          {
            "startSeconds": 1.2,
            "endSeconds": 1.3,
            "min": -0.10000000149011612,
            "max": 0.10000000149011612,
            "rms": 0.07071067825957048
          },
          {
            "startSeconds": 1.3,
            "endSeconds": 1.4,
            "min": -0.10000000149011612,
            "max": 0.10000000149011612,
            "rms": 0.07071067825957048
          },
          {
            "startSeconds": 1.4,
            "endSeconds": 1.5,
            "min": -0.10000000149011612,
            "max": 0.10000000149011612,
            "rms": 0.07071067825957048
          },
          {
            "startSeconds": 1.5,
            "endSeconds": 1.6,
            "min": -0.10000000149011612,
            "max": 0.10000000149011612,
            "rms": 0.07071067825957048
          },
          {
            "startSeconds": 1.6,
            "endSeconds": 1.7,
            "min": -0.10000000149011612,
            "max": 0.10000000149011612,
            "rms": 0.07071067825957048
          },
          {
            "startSeconds": 1.7,
            "endSeconds": 1.8,
            "min": -0.10000000149011612,
            "max": 0.10000000149011612,
            "rms": 0.07071067825957048
          },
          {
            "startSeconds": 1.8,
            "endSeconds": 1.9,
            "min": -0.10000000149011612,
            "max": 0.10000000149011612,
            "rms": 0.07071067825957048
          },
          {
            "startSeconds": 1.9,
            "endSeconds": 2,
            "min": -0.10000000149011612,
            "max": 0.10000000149011612,
            "rms": 0.07071067825957048
          }
        ],
        "loudnessTimeline": [
          {
            "timeSeconds": 0.10000003333333334,
            "momentaryLufs": null,
            "shortTermLufs": null
          },
          {
            "timeSeconds": 0.19999983333333332,
            "momentaryLufs": null,
            "shortTermLufs": null
          },
          {
            "timeSeconds": 0.29999983333333335,
            "momentaryLufs": null,
            "shortTermLufs": null
          },
          {
            "timeSeconds": 0.39999983333333333,
            "momentaryLufs": -23,
            "shortTermLufs": null
          },
          {
            "timeSeconds": 0.49999983333333337,
            "momentaryLufs": -23,
            "shortTermLufs": null
          },
          {
            "timeSeconds": 0.5999998333333334,
            "momentaryLufs": -23,
            "shortTermLufs": null
          },
          {
            "timeSeconds": 0.6999998333333334,
            "momentaryLufs": -23,
            "shortTermLufs": null
          },
          {
            "timeSeconds": 0.7999998333333334,
            "momentaryLufs": -23,
            "shortTermLufs": null
          },
          {
            "timeSeconds": 0.8999998333333333,
            "momentaryLufs": -23,
            "shortTermLufs": null
          },
          {
            "timeSeconds": 0.9999998333333333,
            "momentaryLufs": -23,
            "shortTermLufs": null
          },
          {
            "timeSeconds": 1.0999998333333334,
            "momentaryLufs": -23,
            "shortTermLufs": null
          },
          {
            "timeSeconds": 1.1999998333333333,
            "momentaryLufs": -23,
            "shortTermLufs": null
          },
          {
            "timeSeconds": 1.2999998333333334,
            "momentaryLufs": -23,
            "shortTermLufs": null
          },
          {
            "timeSeconds": 1.3999998333333334,
            "momentaryLufs": -23,
            "shortTermLufs": null
          },
          {
            "timeSeconds": 1.4999998333333333,
            "momentaryLufs": -23,
            "shortTermLufs": null
          },
          {
            "timeSeconds": 1.5999998333333334,
            "momentaryLufs": -23,
            "shortTermLufs": null
          },
          {
            "timeSeconds": 1.6999998333333333,
            "momentaryLufs": -23,
            "shortTermLufs": null
          },
          {
            "timeSeconds": 1.7999998333333334,
            "momentaryLufs": -23,
            "shortTermLufs": null
          },
          {
            "timeSeconds": 1.8999998333333334,
            "momentaryLufs": -23,
            "shortTermLufs": null
          },
          {
            "timeSeconds": 1.9999998333333333,
            "momentaryLufs": -23,
            "shortTermLufs": null
          }
        ],
        "coverage": {
          "waveformBinSeconds": 0.10000000000000009,
          "loudnessStride": 1,
          "eventsCapped": false
        },
        "settings": {
          "clippingThreshold": 0.999,
          "nativeThreads": 1
        }
      }
    },
    {
      "file": "sample.wav",
      "state": "completed",
      "analysis": {
        "schemaVersion": 1,
        "kind": "analysis",
        "input": {
          "schemaVersion": 1,
          "kind": "inspection",
          "file": {
            "name": "sample.wav",
            "sizeBytes": 384044,